{
  "schemaVersion": "glyph-native-reference-model-preflight/v1",
  "generatedAt": "2026-07-24T23:33:42.814628Z",
  "verdict": "pass",
  "configSha256": "7929f1bb780c9c90808bdd7f1f5f53a2904c17d18aeeadc1cd83781b17d6a1eb",
  "pipeline": {
    "class": "StableDiffusionXLControlNetPipeline",
    "baseRole": "native-reference-generator",
    "controlRole": "stock-depth-baseline-and-integration-authority",
    "browserSizeCriterion": null,
    "weightFiles": "default-safetensors",
    "runtimeDtype": "float16"
  },
  "runtime": {
    "dockerContext": "gpu-4090",
    "artifactRoot": "/mnt/docker-data/glyphcss-ascii-image-generation/models/native-reference",
    "python": "3.11.10",
    "torch": "2.5.1+cu121",
    "diffusers": "0.31.0",
    "transformers": "4.45.2",
    "safetensors": "0.4.5"
  },
  "repositories": [
    {
      "id": "sdxl-base-1.0",
      "role": "base",
      "repository": "stabilityai/stable-diffusion-xl-base-1.0",
      "revision": "462165984030d82259a11f4367a4eed129e94a7b",
      "resolvedRevision": "462165984030d82259a11f4367a4eed129e94a7b",
      "variant": "default-safetensors",
      "artifactRoot": "/mnt/docker-data/glyphcss-ascii-image-generation/models/native-reference/sdxl-base-1.0/462165984030d82259a11f4367a4eed129e94a7b",
      "files": [
        {
          "path": "README.md",
          "kind": "model-card",
          "bytes": 8668,
          "sha256": "40d263065b8a3e9a41996c257e11463fd97ae956ebf4e3f8b9625e0d78183893",
          "url": "https://huggingface.co/stabilityai/stable-diffusion-xl-base-1.0/resolve/462165984030d82259a11f4367a4eed129e94a7b/README.md"
        },
        {
          "path": "LICENSE.md",
          "kind": "license",
          "bytes": 14109,
          "sha256": "19b6998b569b53ac1fc2158a8a3202c8699a9a4605b47075715d9c96be7fb6d0",
          "url": "https://huggingface.co/stabilityai/stable-diffusion-xl-base-1.0/resolve/462165984030d82259a11f4367a4eed129e94a7b/LICENSE.md"
        },
        {
          "path": "model_index.json",
          "kind": "config",
          "bytes": 609,
          "sha256": "6d7b93508390ab91ac5bfbe4aeb4dc2d83f7bb1b05fb069d714b5b0c75f70d44",
          "url": "https://huggingface.co/stabilityai/stable-diffusion-xl-base-1.0/resolve/462165984030d82259a11f4367a4eed129e94a7b/model_index.json"
        },
        {
          "path": "scheduler/scheduler_config.json",
          "kind": "config",
          "bytes": 479,
          "sha256": "af3e45a949aff8b8341ab8b811429ec03fee857a700a1d9477363e4fff9666e2",
          "url": "https://huggingface.co/stabilityai/stable-diffusion-xl-base-1.0/resolve/462165984030d82259a11f4367a4eed129e94a7b/scheduler/scheduler_config.json"
        },
        {
          "path": "text_encoder/config.json",
          "kind": "config",
          "bytes": 565,
          "sha256": "39b8b2e4b1949e36969caa425b6c81c68bace99198dd9078ce05d16ad401fe7f",
          "url": "https://huggingface.co/stabilityai/stable-diffusion-xl-base-1.0/resolve/462165984030d82259a11f4367a4eed129e94a7b/text_encoder/config.json"
        },
        {
          "path": "text_encoder/model.safetensors",
          "kind": "safetensors",
          "bytes": 492265168,
          "sha256": "5c3d6454dd2d23414b56aa1b5858a72487a656937847b6fea8d0606d7a42cdbc",
          "url": "https://huggingface.co/stabilityai/stable-diffusion-xl-base-1.0/resolve/462165984030d82259a11f4367a4eed129e94a7b/text_encoder/model.safetensors"
        },
        {
          "path": "text_encoder_2/config.json",
          "kind": "config",
          "bytes": 575,
          "sha256": "a892d1c3a69a7e9247a24de2bc1d5891e3109a54696e53be20093af671072c34",
          "url": "https://huggingface.co/stabilityai/stable-diffusion-xl-base-1.0/resolve/462165984030d82259a11f4367a4eed129e94a7b/text_encoder_2/config.json"
        },
        {
          "path": "text_encoder_2/model.safetensors",
          "kind": "safetensors",
          "bytes": 2778702264,
          "sha256": "3a6032f63d37ae02bbc74ccd6a27440578cd71701f96532229d0154f55a8d3ff",
          "url": "https://huggingface.co/stabilityai/stable-diffusion-xl-base-1.0/resolve/462165984030d82259a11f4367a4eed129e94a7b/text_encoder_2/model.safetensors"
        },
        {
          "path": "tokenizer/merges.txt",
          "kind": "tokenizer",
          "bytes": 524619,
          "sha256": "9fd691f7c8039210e0fced15865466c65820d09b63988b0174bfe25de299051a",
          "url": "https://huggingface.co/stabilityai/stable-diffusion-xl-base-1.0/resolve/462165984030d82259a11f4367a4eed129e94a7b/tokenizer/merges.txt"
        },
        {
          "path": "tokenizer/special_tokens_map.json",
          "kind": "tokenizer",
          "bytes": 472,
          "sha256": "c4864a9376a8401918425bed71fc14fc0e81f9b59ec45c1cf96cccb2df508eac",
          "url": "https://huggingface.co/stabilityai/stable-diffusion-xl-base-1.0/resolve/462165984030d82259a11f4367a4eed129e94a7b/tokenizer/special_tokens_map.json"
        },
        {
          "path": "tokenizer/tokenizer_config.json",
          "kind": "tokenizer",
          "bytes": 737,
          "sha256": "19d7b034cb0cc3ce9766c2231373ab8aa8991fc72e2c8f76558bfaae3de0d563",
          "url": "https://huggingface.co/stabilityai/stable-diffusion-xl-base-1.0/resolve/462165984030d82259a11f4367a4eed129e94a7b/tokenizer/tokenizer_config.json"
        },
        {
          "path": "tokenizer/vocab.json",
          "kind": "tokenizer",
          "bytes": 1059962,
          "sha256": "e089ad92ba36837a0d31433e555c8f45fe601ab5c221d4f607ded32d9f7a4349",
          "url": "https://huggingface.co/stabilityai/stable-diffusion-xl-base-1.0/resolve/462165984030d82259a11f4367a4eed129e94a7b/tokenizer/vocab.json"
        },
        {
          "path": "tokenizer_2/merges.txt",
          "kind": "tokenizer",
          "bytes": 524619,
          "sha256": "9fd691f7c8039210e0fced15865466c65820d09b63988b0174bfe25de299051a",
          "url": "https://huggingface.co/stabilityai/stable-diffusion-xl-base-1.0/resolve/462165984030d82259a11f4367a4eed129e94a7b/tokenizer_2/merges.txt"
        },
        {
          "path": "tokenizer_2/special_tokens_map.json",
          "kind": "tokenizer",
          "bytes": 460,
          "sha256": "f118ab3a983206e4f32583448de6bd6aae4ee21869135cef1f5848a753cdaab6",
          "url": "https://huggingface.co/stabilityai/stable-diffusion-xl-base-1.0/resolve/462165984030d82259a11f4367a4eed129e94a7b/tokenizer_2/special_tokens_map.json"
        },
        {
          "path": "tokenizer_2/tokenizer_config.json",
          "kind": "tokenizer",
          "bytes": 725,
          "sha256": "c9d23941f76a41cbd50eda9290f57be7828f0a7a677939e9ef181f7e12bd1bdf",
          "url": "https://huggingface.co/stabilityai/stable-diffusion-xl-base-1.0/resolve/462165984030d82259a11f4367a4eed129e94a7b/tokenizer_2/tokenizer_config.json"
        },
        {
          "path": "tokenizer_2/vocab.json",
          "kind": "tokenizer",
          "bytes": 1059962,
          "sha256": "e089ad92ba36837a0d31433e555c8f45fe601ab5c221d4f607ded32d9f7a4349",
          "url": "https://huggingface.co/stabilityai/stable-diffusion-xl-base-1.0/resolve/462165984030d82259a11f4367a4eed129e94a7b/tokenizer_2/vocab.json"
        },
        {
          "path": "unet/config.json",
          "kind": "config",
          "bytes": 1680,
          "sha256": "30ebc70750223e59006f7f2b4e1e6c102570aa19a9c4ae3e1fbe7591332dbae6",
          "url": "https://huggingface.co/stabilityai/stable-diffusion-xl-base-1.0/resolve/462165984030d82259a11f4367a4eed129e94a7b/unet/config.json"
        },
        {
          "path": "unet/diffusion_pytorch_model.safetensors",
          "kind": "safetensors",
          "bytes": 10270077736,
          "sha256": "357650fbfb3c7b4d94c1f5fd7664da819ad1ff5a839430484b4ec422d03f710a",
          "url": "https://huggingface.co/stabilityai/stable-diffusion-xl-base-1.0/resolve/462165984030d82259a11f4367a4eed129e94a7b/unet/diffusion_pytorch_model.safetensors"
        },
        {
          "path": "vae/config.json",
          "kind": "config",
          "bytes": 642,
          "sha256": "0b331c8ac22ded5f9997a144a575c1d113d6169aff262c353f39015bd24a6264",
          "url": "https://huggingface.co/stabilityai/stable-diffusion-xl-base-1.0/resolve/462165984030d82259a11f4367a4eed129e94a7b/vae/config.json"
        },
        {
          "path": "vae/diffusion_pytorch_model.safetensors",
          "kind": "safetensors",
          "bytes": 334643268,
          "sha256": "1598f3d24932bcfe6634e8b618ea1e30ab1d57f5aad13a6d2de446d2199f2341",
          "url": "https://huggingface.co/stabilityai/stable-diffusion-xl-base-1.0/resolve/462165984030d82259a11f4367a4eed129e94a7b/vae/diffusion_pytorch_model.safetensors"
        }
      ],
      "treeSha256": "7f6ae040710efbe8e2eb53dc0d8c3072ec176c38809d8db6c006fb1b792860e2",
      "safetensorsParameters": 3468837867
    },
    {
      "id": "controlnet-depth-sdxl-1.0",
      "role": "depth-control",
      "repository": "diffusers/controlnet-depth-sdxl-1.0",
      "revision": "17bb97973f29801224cd66f192c5ffacf82648b4",
      "resolvedRevision": "17bb97973f29801224cd66f192c5ffacf82648b4",
      "variant": "default-safetensors",
      "artifactRoot": "/mnt/docker-data/glyphcss-ascii-image-generation/models/native-reference/controlnet-depth-sdxl-1.0/17bb97973f29801224cd66f192c5ffacf82648b4",
      "files": [
        {
          "path": "README.md",
          "kind": "model-card",
          "bytes": 3545,
          "sha256": "be405809fe11b9dd5697c25b6a70b819ab8c59cc196f2da1eefcfdcab2335893",
          "url": "https://huggingface.co/diffusers/controlnet-depth-sdxl-1.0/resolve/17bb97973f29801224cd66f192c5ffacf82648b4/README.md"
        },
        {
          "path": "config.json",
          "kind": "config",
          "bytes": 1274,
          "sha256": "5cbf68b91bd3065716b88b9ef85785023fef6f59ffae2d5762b05553cef9450d",
          "url": "https://huggingface.co/diffusers/controlnet-depth-sdxl-1.0/resolve/17bb97973f29801224cd66f192c5ffacf82648b4/config.json"